site,published_at,title,authors,preamble,link
Aftonbladet Ledare,2026-07-09T06:00+02:00,Ungdomar vill bli vuxna – men var ska de bo?,Lina Stenberg,Allt fler unga vuxna tvingas bo kvar hos sina föräldrar. Detta visar en undersökning från Hyresgästföreningen.,https://www.aftonbladet.se/ledare/a/rr5EQR/ungdomar-vill-bli-vuxna-men-var-ska-de-bo
DN Ledare,2026-07-08T18:11+02:00,Ledare: Erdogan beter sig som en diktator och alla bara ler,DN:s ledarredaktion,Turkiets president låser in komiker och trädkramande pensionärer. Europas ledare säger inte ett knyst utan ser mannen i Ankara som en reservplan när Donald Trump hotar alliansen. Det är naivt så det förslår.,https://www.dn.se/ledare/erdogan-beter-sig-som-en-diktator-och-alla-bara-ler/
DN Ledare,2026-07-09T05:10+02:00,Annika Ström Melin: Europas högerextrema drottning närmar sig förhoppningsvis slutet på sin politiska karriär,Annika Ström Melin,Marine Le Pen gör ett fjärde försök att bli Frankrikes president. Hon verkar vara desperat. Samtidigt syns en spricka mellan Le Pen och kronprinsen Jordan Bardella. KOLUMNEN. Annika Ström Melin är journalist och fristående kolumnist på Dagens Nyheters ledarsida.,https://www.dn.se/ledare/annika-strom-melin-europas-hogerextrema-drottning-narmar-sig-forhoppningsvis-slutet-pa-sin/
DN Ledare,2026-07-09T06:20+02:00,"Bengt Norborg: Hon ger allt för sitt land, men korrupta ukrainare skonar inte någon",DN:s ledarredaktion,"Ukraina utkämpar inte bara ett krig mot den ryska terrorn. Korruptionen är fortfarande en röta som hotar demokratin inifrån – och hela tiden kräver nya offer. SOMMARRÖSTER. Under sommaren bjuder ledarredaktionen in några av sina favoriter att breda ut sig i valfritt ämne. Bengt Norborg har bevakat kriget som korrespondent för SVT, de senaste åren i Ukraina.",https://www.dn.se/ledare/bengt-norborg-hon-ger-allt-for-sitt-land-men-korrupta-ukrainare-skonar-inte-nagon/
Expressen Ledare,2026-07-08T18:00+02:00,Bomba civila är mindre allvarligt än dopning,Expressens ledarredaktion,"IOK:s beslut att välkomna ryssarna till OS i Los Angeles måste stoppas. Vladimir Putin, efterlyst krigsbrottsling, fick ett glädjebud från IOK.",https://www.expressen.se/ledare/bomba-civila-ar-mindre-allvarligt-an-dopning/
Expressen Ledare,2026-07-09T06:10+02:00,Trump har upptäckt en ekonomisk atombomb,Rutger Brattström,Trump sitter med en knapp som kan stänga av vår ekonomi. Europa måste låta sina företag jobba ostört för att komma ikapp. Trump kan spränga den europeiska ekonomin.,https://www.expressen.se/ledare/rutger-brattstrom/trump-har-upptackt-en--ekonomisk-atombomb/
SvD Ledare,2026-07-09T06:00+02:00,Bra dagar för Europas säkerhet,Olof Ehrenkrona,Sverige bevisar att Europa kan om Europa vill.,https://www.svd.se/a/wrxdrn/sverige-och-saab-bevisar-att-europa-kan-om-europa-vill
