site,published_at,title,authors,preamble,link
DN Debatt,2026-07-12T20:00+02:00,”Landsbygden kan lika gärna vara motorn i omställningen”,"Erland Mårald, professor i idéhistoria på Umeå universitet samt ledare för projektet Peripheral Visions","DN Debatt. Framställs som dömd till bilen och bensinen. Men det skulle kunna vara precis tvärtom, skriver Erland Mårald, professor i idéhistoria.",https://www.dn.se/debatt/landsbygden-kan-lika-garna-vara-motorn-i-omstallningen/
DN Debatt,2026-07-13T08:23+02:00,”Kolonier ställer inga krav – det har vi gjort”,"Stefan Dalin (S), kommunstyrelsens ordförande, Timrå kommun samt ordförande, Torsboda industrial park AB","DN Debatt replik. Inte vårt jobb att kompensera statens frånvaro, skriver Stefan Dalin (S), Timrå kommuns styrelseordförande.",https://www.dn.se/debatt/kolonier-staller-inga-krav-det-har-vi-gjort/
Dagens industri Debatt,2026-07-13T08:00+02:00,Rikspolischefen: Nya mått krävs för dagens polisarbete,Petra Lundh,"Brottsligheten kommer inte att bli mindre komplex. Därför behöver vi fortsätta förbättra våra utredningsresultat, men också bredda samtalet om polisens resultat. För när brottsligheten förändras måste också vårt sätt att förstå polisens resultat göra det, skriver Petra Lundh. rikspolischef.",https://www.di.se/debatt/rikspolischefen-nya-matt-kravs-for-dagens-polisarbete/
Dagens industri Debatt,2026-07-13T08:00+02:00,S: Ändra Sveriges position om kortare betaltider,"Mikael Damberg, ekonomisk-politisk talesperson (S) Fredrik Olovsson, närings- och energipolitisk talesperson (S); Fredrik Olovsson","Om vi får väljarnas förtroende efter nästa val kommer Sverige att stödja arbetet för kortare betaltider i EU. Det är helt enkelt dags att ta Sveriges små och medelstora företag på allvar, skriver Mikael Damberg, ekonomisk-politisk talesperson (S) och Fredrik Olovsson, närings- och energipolitisk talesperson (S).",https://www.di.se/debatt/s-andra-sveriges-position-om-kortare-betaltider/
Expressen Debatt,2026-07-12T19:38+02:00,DEBATT: Om kriget kommer ska tågen gå i tid,"Daniel Helldén; Linus Lakso (MP), trafikpolitisk talesperson","Brister i den svenska tågtrafiken märks av varje dag. Därför är det hög tid att ta fram en nationell beredskapsplan för järnvägen, skriver Daniel Helldén (MP) och Linus Lakso (MP).",https://www.expressen.se/debatt/debatt-om-kriget-kommer-ska-tagen-ga-i-tid/
Expressen Debatt,2026-07-13T05:00+02:00,DEBATT: Föräldrar förtjänar en egen hemsida,"Therese Svanström, ordförande för Tjänstemännens Centralorganisation, TCO. Paraplyorganisationen samlar 1,2 miljoner medlemmar; Av Therese Svanström, ordförande TCO","Vi behöver göra det enklare att välja jämställt. Det kan vi göra genom en hemsida för föräldrar och ändrade ekonomiska incitament, skriver Therese Svanström, ordförande för TCO. Therese Svanström är ordförande för Tjänstemännens Centralorganisation, TCO. Paraplyorganisationen samlar 1,2 miljoner medlemmar.",https://www.expressen.se/debatt/debatt-foraldrar-fortjanar-en-egen-hemsida/
GP Debatt,2026-07-13T04:55+02:00,2027 behöver hyreshöjningarna halveras i Göteborg,"Ronny Bengtsson, ordförande Hyresgästföreningen region Västra Sverige","De senaste tre åren har vi haft de högsta hyreshöjningarna på över trettio år. Men nu när ekonomin vänder och kostnadsökningarna minskar kraftigt måste det märkas även i hyresgästernas plånböcker. Nästa års hyreshöjningarna måste bli mycket lägre, skriver Ronny Bengtsson på Hyresgästföreningen.",https://www.gp.se/debatt/2027-behover-hyreshojningarna-halveras-i-goteborg.5bdf4a0c-c83a-46ed-9c49-f1641570f9e3
GP Debatt,2026-07-13T05:00+02:00,Väljarna säger nej till jakt på hotade arter – politiken säger ja,"Misha Istratov, ordförande insamlingsstiftelsen Artkrisen","Under en hel politikervecka i Visby, mitt i ett valår, nämndes knappt de hotade arterna. Det är anmärkningsvärt, för på få frågor är svenskarna så eniga som här. En färsk Sifo-undersökning som stiftelsen Artkrisen låtit göra visar nämligen att mer än nio av tio svenskar anser att Sverige har ett ansvar att skydda sina hotade arter, skriver Misha Istratov.",https://www.gp.se/debatt/valjarna-sager-nej-till-jakt-pa-hotade-arter-politiken-sager-ja.881c2849-c47f-498e-8fbc-5c043dc9dabf
SvD Debatt,2026-07-12T19:45+02:00,Forskare: Varför skära så hårt i transportforskningen?,transportforskare från tolv svenska universitet och högskolor,DEBATT. En halvering av Trafikverkets anslag till transport­forskningen under den kommande tolvårs­perioden kommer att få mycket stora konsekvenser. Det skriver transportforskare från tolv svenska universitet och högskolor.,https://www.svd.se/a/6qW5J8/forskare-varfor-skara-sa-hart-itransportforskningen
