site,published_at,title,authors,preamble,link
DN Debatt,2026-07-16T20:00+02:00,”Regelkrångel hindrar lantbrukarna från att göra sitt jobb”,"Ebba Busch, Ebba Busch (KD), partiledare; Peter Kullgren","DN Debatt. De ska inte behöva lägga sin tid på blanketter, dokumentation och myndighetskontakter, skriver Ebba Busch och Peter Kullgren för Kristdemokraterna",https://www.dn.se/debatt/regelkrangel-hindrar-lantbrukarna-fran-att-gora-sitt-jobb/
Expressen Debatt,2026-07-16T20:01+02:00,DEBATT: Nu vill högerkanten bli av med sin slagpåse,Emma Wiesner,"I morgon presenterar kommissionen nya regler för världens effektivaste klimatverktyg: utsläppshandeln. Högerextrem politik gör att den kan försvagas, skriver EU-parlamentarikern Emma Wiesner (C). Emma Wiesner (C) är EU-parlamentariker och har varit förhandlare för revideringen av ETS.",https://www.expressen.se/debatt/debatt-nu-vill-hogerkanten-bli-av-med-sin-slagpase/
Expressen Debatt,2026-07-17T05:15+02:00,DEBATT: Vad gör SVT och SR med din data?,"Rasmus Elfström, ordförande för Centerstudenter och kandiderar för Centerpartiet i höstens riksdagsval","Det är inte bara Instagram och Netflix som spårar dig. SVT och Sveriges Radio gör samma sak – och skickar din data till USA. Det är dags att public service lägger korten på bordet, skriver Rasmus Elfström (C). Rasmus Elfström är ordförande för Centerstudenter och kandiderar för Centerpartiet i höstens riksdagsval.",https://www.expressen.se/debatt/debatt-vad-gor-svt-och-sr-med-din-data/
GP Debatt,2026-07-17T04:55+02:00,"Blir det marknadshyror, Jimmie Åkesson?","Mattias Jonsson (S), riksdagsledamot och partidistriktsordförande i Göteborg","Vanligt folk med vanliga löner har redan fått betala ett högt pris för Tidöpartiernas politiska misslyckanden. Efter år av höga priser, massarbetslöshet och låg tillväxt tänker Moderaterna nu lägga nästa nota på hårt arbetande svenskar genom att chockhöja deras hyror. Det är direkt oansvarigt. Nu måste Jimmie Åkesson ge besked – tänker Sverigedemokraterna släppa fram Moderaternas marknadshyror? skriver socialdemokraterna Tobias Baudin och Mattias Jonsson.",https://www.gp.se/debatt/blir-det-marknadshyror-jimmie-akesson.d84742ec-a16f-458d-b8b3-679dada77c83
GP Debatt,2026-07-17T05:00+02:00,Grön tillväxt räcker inte – dags att överge BNP,"Thomas Hahn, docent i ekologisk ekonomi, Stockholm Resilience Centre; Matteo Pedercini, tillförordnad ordförande och operativ chef, Millennium Institute","Medan värmeböljan i Europa skördar liv duger det inte att hoppas på grön tillväxt. Klimatkrisen kräver ett nytt ekonomiskt tänkande. Sveriges ekonomi behöver skifta fokus från BNP till människors hälsa, trygghet och livskvalitet. Ny forskning visar att en omställning bortom tillväxtjakt kan minska miljöbelastningen, samtidigt som sysselsättning och jämlikhet stärks, skriver fem forskare och hållbarhetsexperter.",https://www.gp.se/debatt/gron-tillvaxt-racker-inte-dags-att-overge-bnp.d849318e-f9eb-4b13-86b6-dc79741eb104
SvD Debatt,2026-07-16T19:45+02:00,Nils Funcke och Per Lindeberg: Tillsätt en kommission om fallet da Costa,Nils Funcke; Per Lindeberg,DEBATT. För ett avslut i da Costa-fallet krävs en gedigen genomgång av processens alla led för att blottlägga orsaken till de fel som ledde till att läkarnas liv slogs i spillror och att en sannolik mördare inte kunnat lagföras. Det skriver Nils Funcke och Per Lindeberg.,https://www.svd.se/a/j0kjl9/nils-funcke-och-per-lindeberg-tillsatt-en-kommission-om-fallet-da-costa
Sydsvenskan Opinion,2026-07-17T05:30+02:00,”Lokalt engagemang och ansvar är inget värt – allt ska styras från Stockholm.”,författarna till den nya boken ”Varning för centralism”,"I dag framställs olikheter ofta som problem, skriver författarna till den nya boken ”Varning för centralism”.",https://www.sydsvenskan.se/opinion/lokalt-engagemang-och-ansvar-ar-inget-vart-allt-ska-styras-fran-stockholm/
